{"contract_d_version":"1.0.0","effect":{"params":{},"type":"epistemic_audit.stage_pending_review","version":"1"},"evaluation":{"disposition":"clear","state":"completed"},"input_authority":{"id":"sha256:254ffdbb3ceaeb7c74717bfc41cffe2dac9178296c286b39aa2f48649f22fc7c","immutable_id":"sha256:ba02ec570b0048832a2fc9f6b958f426b11e5dc0fe73cf1e12ae515d38ea23a0","kind":"contract-c"},"metadata":{"diagnostics":{"decomposition_id":"D-PIPE-PROD-RC0","operator":"all_of","parent_conclusion":"supported"},"reason_codes":["contract_c_supported"]},"policy":{"id":"decision-engine.contract-c.epistemic-audit-stage-pending-review","version":"1.0.0"},"target":{"content_sha256":"sha256:fe9a393b0c31f7e2f200cbefc08d9293e364f8a0810865a73003ec3502c387d0","id":"ROOT","kind":"claim"}}
