{"contract_d_version":"1.0.0","effect":{"params":{"scope":"claim"},"type":"knowledge.add_verified_tag","version":"1"},"evaluation":{"disposition":"hold","state":"completed"},"input_authority":{"id":"sha256:5886bf3db050fc8c04bf87f89af53238af77f67cd5de4ab537508d32599233e6","immutable_id":"sha256:f152754526aa7ea3b47401e9ae956786c73ae6795a53bfabc2a163474bc7f526","kind":"contract-c"},"metadata":{"diagnostics":{"decomposition_id":"D-PIPE-PROD-RC0","operator":"all_of","parent_conclusion":"not_checkable"},"reason_codes":["contract_c_reported_verdict_not_supported"]},"policy":{"id":"decision-engine.contract-c.supported-claim-verification","version":"1.0.0"},"target":{"content_sha256":"sha256:fe9a393b0c31f7e2f200cbefc08d9293e364f8a0810865a73003ec3502c387d0","id":"ROOT","kind":"claim"}}
