{"contract_d_version":"1.0.0","effect":{"params":{"scope":"claim"},"type":"knowledge.add_verified_tag","version":"1"},"evaluation":{"disposition":"hold","state":"completed"},"input_authority":{"id":"sha256:999fa91b83ed94555fd5cae5a6cd578ba9a2069b0bec050af76ae7ee22319a31","immutable_id":"sha256:60328dc4413a436b4559a975a60fe35e67e3e1253289ad7c63bca512af41374d","kind":"contract-c"},"metadata":{"diagnostics":{"decomposition_id":"D-PIPE-PROD-RC0","operator":"all_of","parent_conclusion":"contradicted"},"reason_codes":["contract_c_reported_verdict_not_supported"]},"policy":{"id":"decision-engine.contract-c.supported-claim-verification","version":"1.0.0"},"target":{"content_sha256":"sha256:fe9a393b0c31f7e2f200cbefc08d9293e364f8a0810865a73003ec3502c387d0","id":"ROOT","kind":"claim"}}
